restaurant_name,id,writer,date,title,content,tags,sympathy,post_url,ad_images,광고
정통집 신촌본점,1,럽잇썸,2021. 5. 31. 12:50,[신촌 맛집] 정통집 신촌점," 오늘은 최근에 알게 된 돼지김치구이 맛집인정통집 신촌본점 후기에요친구가 제가 딱 좋아할 스타일이라며데리고갔었던 집인데 ㅋㅋㅋ먹자마자 반했던~마침 신촌이 본점이라길래 숑숑 달려갔어용​​​​​​​​  가보니까 어딘지 바로 알겠더라구요그 신촌 술집 모여있는 골목 거리에 있는데항상 지나갈 때마다 웨이팅 사람들이 너무 많아서도대체 여긴 뭐지?했던 기억이 있는데정통집이었음 𐌅 𐌅 𐌅 𐌅 𐌅 𐌅 𐌅 𐌅​저희도 한 20분 기다렸다가 들어갔어요근데 여기 웨이팅 시스템이 좀 별로임줄 서거나 대기 명부 쓰는게 아니라앞에 그냥 앉아있으면직원분이 나오셔서누가 먼저 오셨어요? 들어오세요이렇게 하는 방식이라…관리가 안 될 듯​​​​​​​  메뉴판 못 찍어서 네이버에서 퍼왔어요소 (₩22,000) 주문​​​​​​ 기본 밑반찬 그릇이나 전체적인 가게 분위기가레트로 감성이에요 ㅋㅋ옥수수콘이랑 마요네즈가 진짜 맛있어요!​​​​​​  맛있게 먹는 방법진짜 이대로 고대로~~먹어야 존맛입니다​​​​​​  오뎅국?탕 까지는 아닌듯한 미지근한 맛별로임ㅋㅋㅋㅋㅋㅋㅋㅋ준맛 정도도 아니고 걍 별로임​​​​​​   드디어 나온 메인 메뉴!삼겹살 오동통하게 잔뜩 들어있는거 보이시나요?돼지김치구이 답게 김치도 잔뜩 들어가구요양파도 듬뿍듬뿍​​​​​​​   좋은 건 자세히 크게 봐야지  ​​​​​​  비계와 살코기의 적절한 비율.아름다운 비율이여요이렇게 고기만 먹어도 맛있어요양념이 진짜 신의 한수인듯합니다삼겹살과의 적절히 어울리는 조화가…마치 입 안에서 벨리댄스를 추는 듯한…​​​​​​  특히 나와있는대로이렇게 쌈으로 먹어주면정말 완벽합니다미친새끼에요미친놈!!! 존나 혼내줄 놈​​​​​​​   깻잎이나 옥수수콘, 마요네즈는먹다가 부족하면얼마든지 가져다 주시기 때문에마음 놓고 잔뜩 넣어서 먹어도 되구요고기도 두 개씩 먹으면더더욱 입 안에서 격렬하게 춤을 추는 맛 💕​​​​​​​  쌈 싸먹는게 지겹다면그 조합 그대로 그냥 먹어도 존맛탱  ​​​​​​  (₩2,000)이런 아름다운 돼지김치구이에 볶음밥이 빠지면 안되죠한국인의 디저트! 후식! 볶음밥!!여기 양념이 맛있어서 그런지볶음밥이 진~짜 맛있어요​​​​​​  아무리 배가 부르셔도볶음밥은 꼭… 꼭… 드셔야돼요… 필수…삼겹살과 김치 기름에 볶은 밥은정말 최고란 말이에오.​​​​​​ 접기/펴기정통집 신촌점볶음밥 소리 들어보셔요안 시킬 수가 없쥬?​​​​​​​  바닥에 야무지게 싹싹 눌러서 먹어줘야돼요𐌅 𐌅 𐌅 𐌅 𐌅 𐌅 𐌅 𐌅​​​​​​​   ​​​​​​  일부러 아껴둔 고기 한 점 얹어서 싸악~너무 맛있었다!​​​​​​​​  50m© NAVER Corp.더보기/OpenStreetMap지도 데이터x© NAVER Corp./OpenStreetMap지도 컨트롤러 범례부동산거리읍,면,동시,군,구시,도국가정통집 신촌점서울특별시 서대문구 연세로9길 7 1층   ","#돼지김치구이, #특미볶음밥, #정통집신촌점, #정통집메뉴, #정통집추천, #신촌맛집, #연세대맛집, #신촌존맛, #정통집존맛, #연세대존맛, #신촌밥집, #연세대밥집, #신촌찐맛집, #신촌인생맛집, #연세대찐맛집, #신촌웨이팅, #정통집웨이팅, #정통집후기, #내돈내산, #솔직후기, #신촌술집, #신촌한식, #신촌삼겹살, #연세대술집, #연세대한식, #연세대삼겹살, #삼겹살맛집, #삼겹살존맛",7,https://blog.naver.com/ssdoj65/222376721759,,X
정통집 신촌본점,2,디저트러버,2022. 7. 18. 15:26,신영픽,"​​안녕하세요!오늘도 신영픽 들고왔습니다( ⁎ ᵕᴗᵕ ⁎ )​여기 맛집도 오래전부터 좋아하던 곳입니다.신촌 갈 일 있으면 무조건 일행들을데리고 가던 곳,,ㅎㅎ​주말 저녁만 되면 웨이팅 30분 이상이에요!!(요즘은 어떤지 모르겠네요,,ㅎㅎ) 매장사진  ​맥도날드 직전 골목으로 들어와서쭈욱 오시면 왼쪽편에 정통집보입니다!!​​  ​약간 노포맛집 스타일,,,ㅋㅋㅋ저녁에 여기서 밥먹으면술이 매우 땡김,,ㅎ​   ​기본적으로돼지김치구이소 24,000중 29,000대 34,000​여기 껍데기도 맛있어요!!그리고 다먹으면 볶음밥 필수!​  ​예전에는 저녁에 오픈이었는데오픈시간이 11시로 바뀌었더라구요다행히 점심만 먹을 수 있는 일정이었는데11시 30분쯤 들어가니까 저희가 첫손님!​ 음식사진 ​   ​기본세팅입니다!벽면에 보면 맛있게 먹는 방법 나와있어요!​하지만 저는 그냥 고기+김치+양파를젤 좋아합니다,,,가끔씩 마요네즈 찍먹하구,,ㅎㅎ​  ​다 조리된 상태로 나와요!!진짜 저는 신촌이 본점이라고 생각하는 사람이라다른 지점에서 먹어본 적 없습니다,,,신촌점 먹어보면 아 여기가 본점이겠거니생각되는 맛이에요,,,,ㅋㅋㅋㅋㅋㅋ​근데 이번에 갔을 때는 평소보다맛이 없긴 했움,,,ㅠㅠ그래도 맛있는편,,,​옛날 맛 돌려내,,,,​ 정통집 ​​간단하게 동영상도 가져왔어용,,,ㅎㅎ​  ​​볶음밥에 치즈추가해서 먹었습니다!받았을 때 치즈가 어디있지??했는데 안에 있더라구용ㅋㅋㅋㅋㅋㅋ​야무지게 먹고 나왔습니당. 50m© NAVER Corp.더보기/OpenStreetMap지도 데이터x© NAVER Corp./OpenStreetMap지도 컨트롤러 범례부동산거리읍,면,동시,군,구시,도국가정통집 신촌점서울특별시 서대문구 연세로9길 7 1층 ​개인적으로 신촌맛집은 정통집과 미분당!!!갈 때마다 미분당 점심, 정통집 저녁으로먹습니당,,,,ㅎㅎ다음에는 미분당 포스팅해볼게요!​도움이 되셨다면 공감과 댓글 부탁드려용! ","#정통집, #정통집신촌점, #신촌맛집, #돼지김치구이, #회식추천, #데이트, #신영픽, #서울맛집, #껍데기, #볶음밥, #유명맛집",5,https://blog.naver.com/tlsdud9876/222817203409,,X
정통집 신촌본점,3,뚜뚜공,2020. 10. 14. 22:07,[신촌] 돼지김치구이 전문점의 신촌 본점 :: 정통집 ::,"술집 거리 들어가는 쪽 사거리에떡하니 있는 항상 사람많은 식당!위치를 참 잘 잡은듯ㅎㅎ​ 50m© NAVER Corp.더보기/OpenStreetMap지도 데이터x© NAVER Corp./OpenStreetMap지도 컨트롤러 범례부동산거리읍,면,동시,군,구시,도국가정통집 신촌점서울특별시 서대문구 연세로9길 7 1층 ​  고기 느낌 살려주는 외관​   시험공부에 지친 공대생은 일찍배고프다ㅋㅋㅋ5시 반쯤에 오니 손님은 거의 없었다.일찍 먹으면 이건 좋은듯밤에 배고프긴 하지만..ㅜㅜ다 먹을때는 거의 만석!​  메뉴는 돼지김치구이 하나!꽃껍데기도 궁금했지만다음에 여럿이 올 때 먹어봐야겠다.참고로 공기밥은 메뉴판에 없는데 천원!(이건 안지키면 선넘는거...)​   기본 반찬은 요렇다.콘과 마요네즈의 등장에 여친 눈반짝!ㅋㅋㅋ오뎅국물은 그냥 그랬다.​​  돼지김치구이 小 [22000]​카카오맵 평에서 호불호가 좀 갈리길래기대 반 걱정 반이였는데충분히 맛있었다!!사실 이 조합은 맛없는게 신기한 조합이긴하다ㅋㅋㅋ매콤달짝한 조합에마요네즈도 섞어먹고하니 꿀맛!!​고기 질감은 부드러운 편은 아닌듯스까스까상태라 정확힌 모르겠지만엄청 좋은 느낌의 고기는 아니었다.  볶음밥 [2000]​이런데는 볶음밥 한번 볶아줘야다 먹고 갔다고 할수있지볶음밥이야 뭐 다 아는 그 맛있음이다.근데 밑 부분이 심하게 탄 거같긴하다...​마무리해보자면​아까 언급한 카카오맵의 불만은 대부분웨이팅과 그에 나오는 서비스 하락 부분인데요즘은 웨이팅 거의 없어서이런 느낌의 돼지김치구이가 땡기면가기 괜찮은 식당인듯!나도 긴 웨이팅을 감수하고갈 곳 아니라는거엔 찬성이다.​​ ","#정통집, #신촌정통집, #신촌맛집, #신촌돼지김치구이, #신촌고깃집",3,https://blog.naver.com/lini45/222115794233,,X
정통집 신촌본점,4,용달맛집 1666 9724,2021. 2. 15. 18:25,신촌맛집 돼지김치구이 전문 정통집,"  ​​​​안녕하세요own입니다.명절 잘 보내셨나요 !이번 명절은 뭔가 긴듯 안길었던것 같은 느낌이예요 🤔오렌만에 아침부터 부지런 떨어서 신촌까지 추천받은밥집에 점심을 먹으러 왔는데, 점심부터 고기라니 !!​​정통집은 돼지 김치구이 전문점인데돼지김치구이는 처음이라 설렜어요 .​​유명하다고도 하고 현재 신촌(본점),강남점,영등포구청점 등등 많은곳에 워치해 있다구 하네요제 친구는 강남,신촌 두곳모두 이미 먹어봤다고 하더라구요 -!​​​​​  ​​​와보니까 한 5년전?3년전에와봤던 갈매기살 집 이더라구요!그 식당이 없어지고 돼지 김치구이집이 생겼나봐요 !​테이블은 한 7-10테이블 정도 있고 !기억이 나는게 지금은 겨울이라 아쉽게도창을 오픈 할 수 없지만, 봄여름 밤에도 따뜻할때통 으로된 문을 다 오픈해서 고기를 먹을 수 있는식당이었는대 그 인테리어는 그대로 유지가 되어있더라구요 ! 날좋아지고 다시 가면 진짜 좋을것 같아요!​​​  ​​​​메뉴는 심플 !돼지김치구이랑 볶음밥이 제일 기본이자많이 먹는 메뉴구요!껍ㄷㅔ기도 맛있다고 합니다 😋강남점에서 먹었을때 양이 적다고 해서 2명이서 방문했지만 돼지김치구이 중 으로 주문했어요 !​​​​  ​​​​​정통집 돼지김치구이 먹는 방법도 친절하게안내되어 있어요.꼭 추천하는 방법으로 드셔보시길 !진짜 단짠 맵달 진짜 맛있어요 🙂🙂🙂​​​​   ​​​​주문하면 바로 기본 상차림이 나오구요​어묵국, 깻잎과채소(쌈재료), 마요네즈,콘옥수수, 마늘, 쌈장​​​​​    ​​​​​돼지김치구이는 다 볶아져서 나오느라조금 시간이 걸립니다. 다 볶아진 구이는버너에 약불 살짝 틀고(따뜻함 유지) 바로 먹어도 되요 !!​​나오자마자 비쥬얼이 엄청 납니다!강남점이랑 양 차이가 있나봐요-소가 2명이 먹기에 적다고 해서 중으로주문했는데 거의 대자 사이즈로 양으로 나온것같다고 하더라구요 !!​​  ​​​​​너무 맵지도 않고, 고기가 질기거나돼지냄새가 나지도 않아요 !!​그리고 김치도 적당히 맵고 달달했어요혹시나 너무 쉰 김치가볶아지는건 아닌가 했는데 취향저격이었오요 !🙂​​​​   ​​​끝으로 볶음밥까지 2개 완료해서 먹었어요 !볶음밥은  조금 아쉬웠어요! 생각했던 맛보다는약간 밍밍? 간이 단짠 느낌은 아니었는데 담백하니먹을수록 좋았어요! 마요소스랑 같이 먹으면 더 맛있더라구요 !​밥 2개 볶았는대 양이 밥4공기 같은 ...😋😋​​진짜 이날 엄청 배부르게 먹어서2시쯤 먹고 밤 10시까지 배불렀답니다 -​​저는 만족스런 식사 였어요 뿌듯 ☺️친구는 양은 적지만 강남점이 뭔가 더감칠맛이 더 나서 좋았다고 하더라구요​신촌점도 맛있었는데 강남이 더 맛있었다고하니까 뭔가 기대되더라구요 다음엔 강남으로 !​​​​​친구평가(둘다 먹어봤던 기준 )맛   강남>신촌양   강남<신촌​​​ 50m© NAVER Corp.더보기/OpenStreetMap지도 데이터x© NAVER Corp./OpenStreetMap지도 컨트롤러 범례부동산거리읍,면,동시,군,구시,도국가정통집 신촌점서울특별시 서대문구 창천동 33-17 1층",,0,https://blog.naver.com/wndowltjd/222244419725,,X
정통집 신촌본점,5,라라,2022. 4. 25. 22:10,신촌 핫플 정통집 웨이팅대박 돼지김치구이 맛집," 신촌 핫플 정통집 웨이팅대박 돼지김치구이 맛집 지난번에 신촌에 술마시러 나왔다가 돌아가는 길에어떤 처음보는 곳에 사람들이 웨이팅이 있는 것을 보고대체 저기는 어떤곳이길래 웨이팅이 저렇게 있나 신기했던 곳그곳은 바로 신촌역에 새로 생긴 돼지김치구이 맛집정통집 이었던 것이다.너무 궁금해서 인터넷으로 찾아보니 정통집은 체인으로 신촌점이 본점성공의정석 꾼에도 나온 대박집꼭 가보고 싶었는데 오늘 드디어 가봤다 ㅋㅋㅋ평일이라 웨이팅 없을줄 알았는데 ㅜㅜ 역시나 웨이팅이 있었다는.신촌 핫플이 바로 이곳이구나.하지만 소주랑 넘넘 잘 어울려서 그정도의 웨이팅은 할만했던 것 같다.   정통집 신촌점0507-1313-7848서울 서대문구 연세로9길 7 1층매일 11:00 - 23:00   퇴근하자마자 후다닥 갔는데 웨이팅이 있었다. 하하....내가 딱 밥시간 맞물려 갔는지나보다 30분정도 늦게 오신 분들은 오히려 웨이팅이 없었던 것 같다.​  안을 슬쩍 보니,술드시는 손님들이 대부분이어서 오래기다릴까 걱정했지만한 20분 정도 기다린 듯 하다.엄청 오래 기다리는건 아니니까 이정도 웨이팅은 할만 한 듯.특히 요즘 날씨가 따뜻해서 바깥에 앉아 있어도 괜찮았다.​  따로 직원 부를 필요 웨이팅 목록에 이름이랑 인원이랑 적고기다리면차례나면 알아서 불러주신다.​  메뉴는 돼지김치구이가 주력이라소중대로 주문하면 된다.우리는 중으로그리고 공기밥이랑 소주 참이슬후레쉬로.공기밥 대신 볶음밥 드시는 분들도 많았다.​  물부터 따르는 남친분.​   기본 상접시가 고기집 분위기랑 안 어울리게 너무너무 상콤했따 ㅋㅋㅋ일부러 이런 그릇 쓰신 것 같다.​  손님이 꽉차 있어서슬쩍 남친 찍는 척 하면서 찍어봤다.실내는 그래도 테이블이 넉넉하게 떨어져있어서 시장바닥 분위기 아니고 괜찮더라.창문 활짝 열려있어 공기도 그렇게 탁하지 않고,인테리어도 깔끔했다.​  음식이 매운맛이라,기본으로 국물은 삼삼한 어묵국물이다.​  고기친구 마늘 쌈장물론 나는 평소엔 둘다 안먹는 편​  특이하게 마요네즈가 있었는데,정통집 돼지김치구이 맛있게먹는 법이 벽에 붙어있어 보니마요네즈를 곁들이라 하더라.마치 매콤한 쭈꾸미 먹는 방법과 비슷하다.​  깻잎과 옥수수통조림도모두 곁들여먹는 것들이었다.나는 평소 상추보다는 깻잎파라서 매우 반가​  공기밥도 나왔다.​  그리고 참이슬후레쉬~잔은 처음처럼이었고​   병따개는 테라였다는여담인데,테라 스푸너 진짜 갖고싶다....ㅜㅜ​  지금다시 보니 돼지김치구이 주문할 때매운맛으로 따로 주문 할 수 있다고 한다.매운 맛 좋아하는 사람이라면 꼭 매운맛으로 주문하시길(일반맛이 매콤한 비주얼에 비하면 덜 맵다)​  티슈는 벽쪽에 붙어 있어서,미리 몇 개 뽑아서 가져다 놓았다.​  정통집의 돼지김치구이는주방에서 완전히 익혀 나오기 때문에,나올때까지의 시간이 꽤 걸리는 편이었다.대신 나오자마자 먹을 수 있는 장점도 있다.​  계속 불을 켜고 드시는 분도 계셨지만,나는 더 탈까봐 불을 끄고 먹었다.양파, 돼지고기 (암퇘지라고 한다), 김치, 고추의 조합​  평소 김치와 돼지고기 함께 먹는것을 좋아했는데그걸 알아서 볶아주니까 넘나 편한 것진짜 소주와 단짝해도 될 메뉴잖아.​  사람들이 왜그렇게 웨이팅 하는지 궁금했는데맛있어서 웨이팅 하는 것이었다.신촌 핫플 다운 맛​ 정통집 동영상으로 담아본신촌 핫플 정통집 돼지김치구이 중자 메뉴​  먹는법 추천해주신대로 먹어봤는데마요네즈는 매콤한 맛을 중화하는 역할을 하긴 하지만,고기자체가 감칠맛이 있어서 오히려 그냥 먹는게 더 맛있었다.후춧가루맛이 많이 나서 딱 내 취향이다.고추 채쳐서 들어간거랑 완전 잘 어울리더라.비주얼만 봤을때는 되게 매울 것 같았지만실제로 먹었을 때 그렇게 맵지 않으며또 김치가 들어갔음에도 불구하고 많이 짜지 않아서굳이 밥이랑 같이 먹지 않아도 짜다는 생각이 전혀 들지 않았다.공기밥 없이 그냥 고기 & 술로 먹다가, 조금 남겨 볶음밥 해 먹어도 좋을 것 같다.솔직히 삼겹살과 목살같이 아무것도 넣지 않고 그냥 생으로 굽굽하는 고기류를 제일 좋아하지만,삼겹살 먹다 질리면 이렇게 이색적인 돼지김치구이 먹으러 오는것도 딱이겠다.웨이팅 20분 했지만 할만했던 신촌 정통집 포스팅 끝.  ​ 신촌 핫플 정통집 웨이팅대박 돼지김치구이 맛집 50m© NAVER Corp.더보기/OpenStreetMap지도 데이터x© NAVER Corp./OpenStreetMap지도 컨트롤러 범례부동산거리읍,면,동시,군,구시,도국가정통집 신촌점서울특별시 서대문구 연세로9길 7 1층   ​ ","#신촌역고기집, #신촌밥집, #신촌고깃집, #신촌역밥집, #신촌고기맛집, #신촌핫플, #돼지김치구이맛집, #정통집",9,https://blog.naver.com/calamary/222711320929,,X
정통집 신촌본점,6,밍,2021. 3. 24. 21:07,[신촌역] 정통집," ​지난번에 맛있게 먹고아무래도 이제 저의 단골집이 될 것 같은정통집을 소개해드릴게요​ 50m© NAVER Corp.더보기/OpenStreetMap지도 데이터x© NAVER Corp./OpenStreetMap지도 컨트롤러 범례부동산거리읍,면,동시,군,구시,도국가정통집 신촌점서울특별시 서대문구 연세로9길 7 1층 ​정통집 신촌점은현대백화점 앞 플레이버스에서세븐일레븐과 유플러스 사이 골목길로 들어가서직진하다 보면 한신포차가 나오는데한신포차 바로 옆에 위치해 있어요신촌점이 본점입니다!  영업시간매일 11:30 - 01:00    ​메뉴는 단일 메뉴에요저렴한 가격의 돼지김치구이와볶음밥, 껍데기, 비빔국수 등이 있어요인스타그램 이벤트도 하고 있으니참여하면 좋을 것 같아요​  ​기본 찬으로 야채들이랑마요네즈, 쌈장, 콘옥수수,어묵 국물이 나와요​  ​주문한지 오래되지 않아서양파, 돼지고기, 김치를 같이 볶은돼지김치구이가 나왔어요​   ​정통집 고기는 국내산 한돈을 쓰고고기도 고기지만김치가 맛있어서맛있는 김치 + 맛있는 고기 조합이맛없기가 어렵잖아요​  ​콘이랑 마요네즈랑이렇게 먹으면 맛있다고 해서 먹었는데개인적인 입맛으론김치랑 양파랑 청양고추랑 고기 넣고깻잎에 쌈 싸 먹는 게 제일 맛있었어요너무 맛있는 게 당연한데또 맛있고 ..​  ​마지막으로 볶음밥을 먹지 않으면또 너무 아쉬우니까조금 남았을 때 볶음밥을 주문했어요볶음밥도 딱 고슬고슬하게 익혀서고소한 맛이었어요​저녁시간에 방문했는데좀 이른 저녁시간 아니면대부분 웨이팅 하는 것 같으니참고하시면 될 것 같아요​가성비도 좋고맛도 있고 정통집 추천드립니다!!!​​*내 돈 내산 리뷰이고주관적인 입맛 참고해 주세요​​​​ ","#돼지김치구이, #신촌역맛집, #신촌맛집, #서대문구맛집, #신촌정통집, #정통집, #신촌역정통집, #신촌돼지고기, #신촌삼겹살, #신촌역삼겹살, #신촌돼지김치구이, #정통집내돈내산, #신촌내돈내산, #신촌역술집, #신촌역저녁, #신촌역점심, #정통집본점",1,https://blog.naver.com/wlals355/222286274123,,X
정통집 신촌본점,7,민생부부,2022. 4. 16. 0:26,구래동 고기집 매콤 쫄깃 돼지김치구이랑 껍데기가 맛있는 정통집,"추억의 맛을 느끼다..♡  돼지김치구이 전문 식당인 정통집! 이번에 김포 구래동 고기집을 찾다가 가보게 된 곳인데, 왠지 낯이 익은 식당인 것 같아 가만 생각해 보니 일산 라페스타에 갔을 때 본 기억이 나더라구요. 알고 보니 이미 많은 곳에 체인점이 있는 정통집이었어요. 본점은 신촌이라고 하네요~   일산에서 봤을 때도 사람이 많았었는데 구래동 정통집에도 사람이 많았어요. 구래동에 고기집들이 많이 있었지만 마침 눈에 띈 정통집의 돼지김치구이 맛이 궁금해서 먹어보기로~​코로나 때문에 이렇게 밖에서 외식하는 일이 많이 줄었었는데, 오랜만에 저녁 시간에 나와 맛있는 거 먹을 생각하니 먹기 전부터 괜히 들뜨더라구요.^^   이곳은 메뉴가 딱 돼지김치구이 소, 중, 대. 그리고 꽃 껍데기가 있어요. 볶음밥과 비빔국수도 있는데 볶음밥은 마지막에 볶아 먹게 될 것이고~ 비빔국수는 별미로 즐기기 좋을꺼 같네요.​메뉴 가짓수가 많지 않지만 돼지김치구이 전문 식당인 만큼 그 맛에 충실할 것 같다는 예상을 해보며~ '소'자 하나와 돼지껍데기 하나를 주문했답니다.  메인이 나오기 전 세팅해 주신 어묵탕과 콘 옥수수 등등~ 근데 여기 어묵탕도 왜 이렇게 맛있는 건지 계속 먹게 되더라구요. ㅎㅎ​맛있게 잘 볶아진 돼지김치구이가 나오고 껍데기도 세팅해 주셨어요. 다 조리되어 나온 거라 약불에 올려놓고 먹으면 된답니다~​한 테이블 가득 차려진 모습에 기분이 막 업되는 중! ^^     깻잎에 고기랑 김치 올리고 마요네즈랑 옥수수콘, 쌈장, 고추, 마늘을 넣어주면 맛있는 한 쌈 완성! 취향에 따라 넣을꺼 넣고 뺄 건 빼고 만들어 먹었어요.^^​정통집의 고기 김치 볶음은 할머니 손맛이 느껴지는 두루치기 느낌이랄까, 단 맛이 나는 양념이 아닌 매콤한 본연의 맛이 살아있는 추억 돋는 맛이 나서 한동안 말도 없이 먹은 거 같아요. ㅎㅎ  많이 맵지 않아서 부담 없이 먹기 좋았고, 고기뿐만 아니라 김치도 넘 맛나서 계속 손이 가더라구요. 흰쌀밥에 먹으면 밥 한 그릇 뚝딱하겠다며~ 근데 우린 볶음밥 먹을 생각에 공깃밥은 따로 안 먹었어요. 다음엔 공기밥에도 먹어봐야겠다는~  양념 소스와 콩가루에 찍어 먹는 껍데기는 너무 고소하고 맛나서 멈출 수가 없는 맛이었어요. 마요네즈를 아주 많이 좋아하는 마요순이는 빨간 양념 소스 제쳐두고 마요네즈에 콕 찍어 먹는 중이구요~ㅎㅎ 고소함이 배가 됨. ^^  마지막으로 먹은 볶음밥도 꿀맛! 배가 부른데도 자꾸만 땡겨서 싹싹 다 먹고 왔다는요.구래동 고기집 정통집은 계속 생각날꺼 같아요. 조만간 또 출동할꺼 같네요~☆  50m© NAVER Corp.더보기/OpenStreetMap지도 데이터x© NAVER Corp./OpenStreetMap지도 컨트롤러 범례부동산거리읍,면,동시,군,구시,도국가정통집 김포구래점경기도 김포시 김포한강9로 81 골든파크프라자 1층예약 ​ ","#정통집, #구래동고기집, #돼지김치구이",4,https://blog.naver.com/seangloran/222702086283,,X
