restaurant_name,id,writer,date,title,content,tags,sympathy,post_url,ad_images,광고
신촌간이회집,174,밍밍,2023. 9. 28. 0:50,생새우회와 새우구이를 동시에 즐길 수 있는 신촌 간이회집 내돈내산 후기,"​신촌에 생새우회가 맛있다는 횟집이 있다고 해서오랜만에 신촌 방문!​​여긴 횟집으로도 유명했던 것 같긴 하다 50m© NAVER Corp.더보기/OpenStreetMap지도 데이터x© NAVER Corp./OpenStreetMap지도 컨트롤러 범례부동산거리읍,면,동시,군,구시,도국가신촌간이회집서울특별시 서대문구 연세로5다길 22 ​신촌에 술집 많은 그 쪽 뒤쪽이다신촌역에서 멀진 않다​​  ​이렇게 가게 앞에 수조에 싱싱한 생선들이 많다​​​  ​조개도 있다​​​  ​오늘의 주인공 새우​​​  ​내부는 꽤 자리가 있는데 사람도 많다화장실도 안에 있어서 좋다​​ 신촌간이회집 메뉴판 ​회랑 여러 해물류도 팔고매운탕 말고 조개탕, 연포탕 같은 탕류도 판다​전어랑 생새우가 지금 철인데기본이 35,000원이다​​  ​계란찜이나 옥수수콘 추가는2000원!​​​   ​제일 먼저 나온 기본찬​번데기랑 강낭콩그리고 근본 콘치즈!!!!!!!! 🌽🌽🌽​​  ​그릇에 가득 채워져 나온 생새우 ..!랩이 씌워져서 나왔는데 이거 제거하면 안된다​양이 꽤 많아서 둘이서 이거에 매운탕 먹어도괜찮을 정도?​​  ​새우가 겁나 팔딱거려서 탈출할 수도 있기 때문..​탈출하지 않도록 랩 조금만 떼서한마리씩만 까먹으면 된다​​  ​최고는..!​생새우 먹다가 구이로 먹고 싶으면새우구이로도 바꿔주신다고 했다​​  ​새우에 찔릴 수도 있으니 목장갑을 끼고비닐장갑도 낀다​​  ​이렇게 조심스럽게 한마리씩 꺼내서​​  ​엄청 팔딱거리므로 ㅠㅠ미안하긴 하지만...​머리부터 제거하고 껍질을 까주면 된다​​   ​통통한 생새우회 ~~  ​  ​생새우의 식감도 뽀득하니 좋고갑각류 특유의 그 달달함이 느껴진다​최고다 최고​초장도 찍어먹고 간장도 찍어먹기 ~​​  ​새우하트 ❤️(세모)​​  ​반쯤 먹다가 또 구이의 맛도 느끼고 싶어서구이도 부탁드렸다​​  ​노릇노릇 익어가는 새우​​  ​아까 생새우회 먹을 때 떼어놨던대가리도 함께 익혔다​​  ​생새우회도 맛있지만..익힌 새우도 존맛이잖아요​또 다른 뽀득한 식감이다  ​  ​이에 이어 새우버터머리구이를 부탁드렸는데보통 주방에서 해다 주시는데이렇게 철판을 주시는데는 처음 봤다​버터에 노릇노릇 볶아서 머리 뽑아먹으면또 존맛이다 후 또 먹고싶네요​​  ​배불렀지만 안주를 위해 광어와 매운탕까지 조지고..술 마시기 너무 좋다 ~~​​   ","#체크인챌린지, #신촌맛집, #신촌회집, #신촌횟집, #신촌새우, #신촌생새우, #신촌대하구이, #신촌새우구이, #신촌간이회집, #간이회집",8,https://blog.naver.com/smin3723/223223531913,,X
신촌간이회집,175,겸디,2024. 5. 20. 10:56,신선하고 맛있는 횟집 [신촌 간이회집] 연어회 광어회 조합," ​​​​안녕하세요다겸입니당~~ㅎㅎㅎ얼마전 친척 모임을 했는데1차로 일반 술집에서 안주랑 먹고2차로 횟집을 가게 됐어요 ㅎㅎ​저는 회를 안좋아하지만가족들이 다들 회를 좋아하고제가 그렇다고 회를 아예 못먹는건아니기 때문에한번 가보게 되었는데용!​생각보다 맛있어서 계속먹게되더라구요!!ㅋㅋㅋ​​​​​ 50m© NAVER Corp.더보기/OpenStreetMap지도 데이터x© NAVER Corp./OpenStreetMap지도 컨트롤러 범례부동산거리읍,면,동시,군,구시,도국가신촌간이회집서울특별시 서대문구 연세로5다길 22 신촌 간이회집 ​  ​​​신촌역에서 멀지 않은 곳에위치하고 있어서찾기도 쉬웠답니당!ㅎㅎ​​​​​​​​​​     ​​수족관 자체가물도 완전 깨끗하고신선해 보이더라구여 ㅎㅎ​​​​  ​뽀글뽀글물고기 귀엽져​근데 먹어야돼요…ㅠㅠ​​​​​​​​​​​  ​​​내부는 이렇게 생겼어요 ㅎㅎ엄청 넓진 않지만불편한 점은 없었어요 ㅎㅎ화장실도 최신식은 아니지만깔끔했어요!ㅎㅎ​​​​​​​​​  ​​메뉴판이 너무 커서이렇게밖에 못찍었어요…ㅋㅋㅋ뭐 먹을까 고민하다가​연어+광어 조합으로주문했어요!!​사실 제가 연어랑 광어밖에못먹어서 ㅎㅎㅎㅎ이렇게 먹자고 추천했어요ㅋㅋ제가 비린거를 진짜 못먹어서이것도 진짜 많이 발전한 거에요ㅋㅋㅋㅋㅋㅋㅋ​  ​​​​​​​​​​​​​​​​   ​​​밑반찬들이 나왔어용역시 횟집에서는콘치즈 빠질 수 없죠!계속 손이 가더라구여 ㅋㅋㅋㅋ​​​​​​​​​​​​   ​​  ​​이 신선한 회 보이시나요!!이 때 진짜 배불렀거든요근데도 맛있어서이 날 꽤 많이 먹었어요!!​와 진짜 신선해서 그런지제가 회를 좋아하지 않는데도계속 들어가는 거에요 ㅋㅋㅋ사실 초장맛으로 먹긴 하는데ㅋㅋㅋㅋㅋㅋㅋㅋㅋ​그래두 진짜 연어는 부드럽고광어는 쫄깃하고 맛났어요 ㅎㅎ​간장에다가 레몬즙을 뿌려서찍어 먹으면 맛있다며친척오빠가 알려주더라구여 ㅋㅋㅋ저는 완전 초장파라서간장은 잘 안찍는데반신반의하며 의심스러운 표정으로한입 먹어봤더니…그냥 그랬어요 ㅋㅋㅋㅋㅋㅋㅋ​역시 초장이 체고야🥰​  ​​​​​​​​​  ​​​​쏘맥도 먹어주고!ㅎㅎ​사실 저는 술도 잘 안먹는데용ㅋㅋㅋ​가족들이 다들 술을 잘마셔서저도 옆에서 기분 좋으니깐계속 마셨어요 ㅋㅋㅋㅋ쏘맥 거의 7-8잔 먹은듯!!​근데 나중에는제가 취해 보이니깐소주를 한두방울밖에 안타주더라구요 ㅋㅋㅋㅋ거의 맥주였던 듯?ㅋㅋㅋㅋ​​평소에는 먹어봐야생맥주 500cc 정도인데이날은 신나서 과음했어요 ㅋㅋㅋ​​​​​​​​​​​  ​​​오랜만에 친척 모임해서반갑기도 하고재밌더라구여 ㅎㅎㅎ​맛있는 회도 먹고수다도 떨고즐거웠답니당​​  ​​​​​​​ ","#신촌회집, #신촌횟집, #신촌간이횟집, #신촌간이회집, #신촌맛집, #광어회, #연어회, #신촌역맛집",177,https://blog.naver.com/qktnadl/223452208001,,X
네이버후드 신촌,176,백곰,2024. 10. 22. 12:46,신촌맥주 - 네이버후드 : 혼술도 가능한 피자 맛집,"신촌맥주 - 네이버후드혼술도 가능한 피자 맛집  ​나의 오랜 단골집신촌맥주, 네이버후드 를 소개하려고 한다이곳을 처음 알게 된 것은 10년 전으로 올라간다그때는 다른 분들이 운영을 하고 있었지만 현재는 나와 가장 친한 형이 운영을 하고 있는 곳피자 맛집으로 소문난 곳인데 피자 레시피를 그대로 전수 받아서이곳은 물론 다른 지역에서 운영하시는 맥주집에서도 피자 맛집으로 인정 받은 그런 곳이라고 할 수 있다하지만 같은 이름으로 한자리를 10년 동안 자리 잡고 있다는 것으로만으로도신뢰가 가지 않는가! ㅋㅋ피맥, 환상 조합을 신촌에서 맛보고 싶다면 이곳으로 오시면 된다​ 외관 및 실내 인테리어  ​​신촌맥주, 네이버후드 은 중심거리에서 살짝 벗어나 있다그래서 처음에 방문할 때는 여기가 맞나 라는 생각을 할 수 있는데네이버 지도상에 나와 있는 곳이 맞으니 걱정하지 않아도 된다​  ​​신촌맥주, 네이버후드 의 실내 모습이다가장 안쪽의 모습인데오래 되었지만 깔끔하게 정리되어 있는 곳이다​  ​​신촌맥주, 네이버후드 에는 수많은 탭이 있다원래는 수제맥주 라인업이 정말로 화려했는데최근 우리나라 수제맥주 시장이 조금 가라앉는 추세다 보니탭수를 많이 줄였다조금 아쉽지만이전에 탭 수가 너무 많긴 했다 ㅋㅋㅋㅋㅋ​   ​생각보다 작은 듯 하면서 넓어서 원하는 자리에 앉을 수 있다​  ​이번 주 맥주를 이렇게 소개하고 있는데보통 최근에 탭을 한 맥주들즉, 신선한 맥주들을 소개한다​   ​주방 및 카운터와 가까운 공간 말고문쪽에 가까운 공간은 이렇다문쪽을 다 열어두어서 확 트인 뷰를 자랑한다신촌맥주, 네이버후드 를 자주 방문하다 보니이날은 마감 전 맥주를 포장하기 위해서 방문했었다그래서 나의 이쁜 포르쉐가 주차되어 있다(지금은 1주일 째 주차장에 방치 중 ㅠㅠ)​  ​한쪽에는 생수와 함께 간단한 과자를 가져다 먹을 수 있다​  ​이 기본 안주도 여러가지 버전이 있었는데역시나 가장 무난한 것으로 ㅋㅋㅋ​  ​피자 맛집이기 때문에기본적으로 앞접시와 포크, 나이프가 제공된다그리고 손으로 먹는 분들을 위해서 물티슈도 ㅋㅋ​ 메뉴판    ​​신촌맥주, 네이버후드 의 메뉴판이다기본적으로 맥주 탭리스트와 함께안주가 나와있다우리는 반반피자를 주문했는데페퍼로니와 베이컨양송이를 주문! ㅋㅋ그리고 폴드 포크 프라이즈를 주문했다​ 옥토퍼페스트비어  ​처음 주문한 맥주는옥토퍼페스트비어이 맥주 진짜 괜찮다라거보다 진하고 그렇다고 DIPA 처럼 강하지 않고 ㅎㅎㅎ​   ​이전에 1L를 포장해서 갔었는데글램핑 장에서 시작과 동시에 순삭​  ​맛있다사실 이날 삿포로에서 집에 저녁 7시 넘어서 도착한 후잠깐 짐정리 후 바로 신촌으로 온 것이라서피곤이 좀 쌓여있어서 맥주를 마구 달리지는 못했지만이 옥토퍼페스트비어최고의 맛이었다​ 반반피자, 페퍼로니 베이컨양송이  ​피자맛집이기 때문에신촌맥주, 네이버후드 에서는 피자를 무조건 주문!!!!! ㅋㅋㅋㅋ너무 맛있는 피자 맛집 ㅋㅋㅋ​  ​반반피자 등장이요두가지 맛을 볼 수 있기 때문에처음 오신 분들은 이 반반피자를 추천한다​   ​피자의 맛을 결정하는 것이 바로 도우 아니겠는가 ㅋㅋㅋㅋ도우가 쫀득하니 맛있다이전에는 치즈를 훨씬 많이 올렸다고 했는데치즈만 많이 올린다고 좋은 평을 듣지 못하셔서기존에 알려준 레시피대로 만드신다고 한다이전에 처음 인수 하셨을 때는 치즈를 더 올려서 더 맛있는 피자를 제공해야지 했었다고 ㅋㅋ우리 사장님 마음 하나는 진짜 손님을 생각하는 마음 최고다​  ​짜잔 이제 먹어볼까아?​ 폴드 포크 프라이즈  ​먹어볼까 했는데폴드 포크 프라이즈가 나왔다​    ​이 메뉴가 뭐냐면감자튀김을 멕시칸 양념이 된 고기와 함께사우어 크림과 함께 나온 것상당히 매력있다​   ​감자 튀김도 웻지 감자와 일반 감자가 있어서진짜 맛있게 먹었다일단 양이 미친듯이 많아서 굿 ㅋㅋㅋㅋ​   ​나는신촌맥주, 네이버후드 에 오면 늘 페퍼로니를 주문한다무난하고 맛있으니까 ㅋㅋㅋ​  ​이 맥주 상당히 매력있어서다음에 또 먹으러 가야겠다 ㅋㅋㅋ​  ​같이 온 지인이 선택한 피자는베이컨양송이 피자이 피자도 굿굿약간 예전 피자헛의 콤비네이션 피자를 생각나게 한다​ 프리마토  ​오랜만에 프리마토가 있어서 주문해보았다바이젠이다예전에 수제맥주가 처음 나왔을때는 바이젠 엄청 좋아했는데점차 IPA, 그리고 DIPA, TIPA로 갔다가크릭 및 고제그리고 임페리얼 스타우트마지막에 스무디 맥주 등등 점차 강해지는 스타일의 맥주로 가게 되었던 것 같다그래도 오래전에 사랑했던 바이젠다시 한 번 맛보자 ㅋㅋㅋ​  ​무난하게 가볍게 먹기 좋다술을 좋아하지 않는 분들도 편하게 먹을 수 있는 맛!​ 수제맥주, 바틀 & 캔  ​​신촌맥주, 네이버후드 의 장점은바틀 및 캔도 많다는 것인데한때 입고 되자 마자 예약을 하지 않으면 먹을 수 없었던 라아프 맥주부터다양하게 있다​ KBS, 임페리얼 스타우트  ​날씨가 쌀쌀해지니이럴때는 KBS를 먹어야 하지 않을까?ㅋㅋ​  ​오랜만에 먹는 KBS커피향이 부드럽게 나면서 진한 임페이얼 스타우트를 느낄 수가 있다​  ​사장님과 함께 짠원래 같이 마시려고 했는데이날 손님들이 너무 많아서사장님은 계속 일만 하심 ㅠㅠㅠㅠ​  ​신촌에서 다양한 맥주를 맛있게 먹고 싶다면그리고 가성비 좋게 먹고 싶다면신촌맥주, 네이버후드 으로 출동하시길 ㅋㅋㅋㅋㅋ​​ 신촌맥주 - 네이버후드 : 혼술도 가능한 피자 맛집 ​  ​ 50m© NAVER Corp.더보기/OpenStreetMap지도 데이터x© NAVER Corp./OpenStreetMap지도 컨트롤러 범례부동산거리읍,면,동시,군,구시,도국가네이버후드서울특별시 서대문구 연세로7안길 41 1층예약 ​신촌맥주 - 네이버후드 : 혼술도 가능한 피자 맛집​  ​ ","#네이버후드, #신촌네이버후드, #신촌맥주, #신촌수제맥주, #신촌혼술, #신촌피자, #신촌맛집, #신촌피자맛집",40,https://blog.naver.com/offspring84/223628756879,,X
네이버후드 신촌,177,크릉이,2024. 10. 19. 23:39,"[서대문구/신촌역:네이버후드]신촌피자,흑맥주맛집,가성비화덕피자,대학생추천,찐후기","안녕하세멍~ 크릉이에여  오늘 신촌에 약속이 있어서네이버후드를방문했어요:-)간단한 정보 먼저!⬇️⬇️ 네이버후드서울 서대문구 연세로7안길 41 1층, 신촌역 1번출구 485m☎ 02-336-6004단체, 배달, 포장, 예약⭕️16:00-01:00 연중무휴 50m© NAVER Corp.더보기/OpenStreetMap지도 데이터x© NAVER Corp./OpenStreetMap지도 컨트롤러 범례부동산거리읍,면,동시,군,구시,도국가네이버후드서울특별시 서대문구 연세로7안길 41 1층예약 창서초등학교 방면으로 쭉 걸어가시다가  사거리방면에서gs25쪽으로 쭉 걸어가시면 됩니닷ʕ•̀ω•́ʔ ✧  이제 도착이에요  가게외관&내부분위기 바로 멀리서부터검은-주황조합의간판이 바로 보인답니닷:-)  내부는 바깥이랑 연결된선선한 바람을 느낄 수 있는 공간이에요 ㅎㅎㅎ아주 넓어서 단체예약으로도 좋을 것 같아요  그리고 폴딩도어를 열면 내부 카운터 공간과내부좌석이 보여요~  높은 테이블도 가운데에 있어서수제맥주 집 제대로 찾아온 기분이었어요   주문메뉴&기본세팅 메인메뉴가 담긴 메뉴판이에요s과l사이즈 피자들과 사이드가 있어욥 ㅎㅎ  수제생맥주를 전문적으로 하는 곳이라종류가 정말 다양해서너무 고민되더라구용🤔🤔   <주문메뉴>반반피자 L 26,000원(모짜렐라 바질, 더치)코젤다크 400ml 7,500원(*시나몬 500원 추가가격)버팔로윙/봉 10,900원 처음에 맥주 제외하고 주문했는데옆 테이블에서 너무 맛있다해서홀리듯이코젤다크추가 주문했어요 (๑´ڡ`๑)  기본세팅은 사장님이 바로식기도구 가져다주셨구용😚  얼마 후에 코젤다크에 시나몬추가한 맥주가먼저 나왔어요!(๑•̀ㅂ•́)و  아니 시나몬 가루가 위에 증말,,,💘가득 뿌려져있거 보이세욥?🥹🥹비주얼이 일단 압승이에요  제가 술찔이라 2번만 먹는다했는데...사실 6-7번은먹었어욬ㅋㅋ😂신촌맥주하면 여기가흑맥주맛집이라 떠서기대하긴 했는데 이렇게 맛있을 줄이야!🩷  한참 극찬이던 와중에메인메뉴와 사이드가함께 등장했어요~😇  반반피자와 버팔로윙 한상푸짐하게 테이블에 가득찼어요(๑´ڡ`๑)  메인메뉴인 반반피자는모짜렐라바질의 은은한 향과 치즈냄새더치피자의 감자&베이컨, 크림치즈의 조합   그리고 원래 피자꼬다리,,사실 그렇게 맛있진 않잖아요?😉그런데 여긴 신촌피자 중에서도화덕이라쫄깃하고 풍작한 식감이🙌🏻보자마자 느껴졌어요    바로더치피자먹고 싶다해서개인접시로 담기 ㄱㄱ!! 반반피자🍕 저희 그냥 바로 쑥 집어 올렸는데늘어나는 치즈양..,,이게 폭포인지 치즈인지 OMGㅋㅋㅋㅋㅋ  이거 덜어주자마자제 마음속 원픽이었던모짜렐라 바질을 선택!  모짜렐라 바질에한 조각당큰 바질 하나와 토마토 그리고 올리브보이시나요?치즈는 당연히 말모...🧀🧀  너무 맛있어요 ㅠㅠㅠ 바질향이 너무 세지않고피자와 은은하게 잘 어울리더라구요!!!이거재구매 의사 100%였어요  그리고 지인픽으로 시킨버팔로윙/봉을 먹어봤어요~🍗  원래는 저는 사이드 시키면 1-2개 먹는데매콤하면서 달달한 향이 너무 좋은거에요 ㅋㅋㅋㅋ  결국 부위별로 하나씩 맛봤는데요☺️이미 살이 야들야들해서 그냥 먹어도 맛있고  같이 주신 소스에 봉을 푹- 찍어먹어도별미로 맛볼 수 있어서 좋았어요!❤️사장님이 피맥 조합을 신경쓴 느낌이 확 들었답니당 ✧•̀.̫•́✧  와 오늘 정말 신촌에서 공부하다가서도파민 더 뿜뿜 터져서피클까지 완그릇했어요 ㅋㅋㅋ.  여기서 주목할 점은 크릉이가🐶원래 피자 2조각먹는데🍕너무 맛있어서 무려 3조각을 먹었답니다.. <솔직후기>1. 코젤다크를 여러 술집에서 먹어봤지만 오랜만에 정말 제대로된 수제생맥주집을 만나서 너무 달콤하고 맛있게 먹었다2. 테라스 야외공간과 내부 공간으로 넓게 4인좌석으로 되어있어서 자리 선택의 폭이 넓어서 좋다3. 피자 잘 못먹는 1인이 최고경신한 3조각을 먹은만큼 맛집이다.4. 피자가 쫄깃하고 화덕st 소화 부담감이 덜하다5. 생맥주가 정말 목넘김이 장난아니라서 피자사이즈를 조절후, 신촌맥주 먹으러 가면 좋겠다:)6. 개인의 기호를 맞춘 반반피자를 추가금없이 선택할 수 있어서 만족한다  그럼 다음 먹도리 일기에서 만나멍멍   ​ ","#신촌맥주, #신촌피자, #네이버후드, #네이버후드솔직후기, #네이버후드신촌, #신촌맛집, #신촌역맛집, #신촌현대백화점맛집, #신촌현대백화점식당, #신촌현대존맛, #신촌존맛, #신촌생맥주, #신촌생맥주맛집, #신촌맥주집, #신촌맥주가성비, #신촌흑맥주, #신촌코젤다크맛집, #신촌화덕피자, #신촌화덕피자맛집, #신촌피자존맛, #신촌피자집존맛, #이대생추천맛집, #연대생추천맛집, #서이추환영, #신촌단체모임맛집, #신촌역단체술집, #신촌역단체술집맛집, #",58,https://blog.naver.com/loveucream/223625608681,,X
네이버후드 신촌,178,뭉,2024. 7. 12. 19:26,네이버후드 | 신촌 고소한 치즈가 가득 들어간 피자와 수제 맥주를 맛볼 수 있는 곳,"​ 네이버후드월-일: 16:00-01:00​전화: 02-336-6004단체이용, 배달, 포장,예약 가능 안녕하세요 !​요즘 장마철이라 비가 자주 내리는데,비가 추적추적 내리는 날 바삭한 도우의 피자와 맥주가 땡겨 신촌에 위치한 네이버 후드에 방문했습니다.​ 50m© NAVER Corp.더보기/OpenStreetMap지도 데이터x© NAVER Corp./OpenStreetMap지도 컨트롤러 범례부동산거리읍,면,동시,군,구시,도국가네이버후드서울특별시 서대문구 연세로7안길 41 1층예약 네이버 후드는 연세대학교 모두의 거리에 위치해있습니다.주변에 술집과 카페가 정말 많더라고요 !​  네이버후드 외관 !통창으로 되어 있어 개방감이 있고, 비 내리는거 보면서 피자 먹으니 넘 좋더라고요 ㅎㅎ​ Previous imageNext image 내부는 바가 있는 안쪽과 통창쪽 크게 2군데로 나누어져 있으며,좌석이 많아 단체로 방문하기 좋을 것 같아요.​  인테리어도 펍 느낌이 물씬 나도록 꾸며져 있었어요.​일반 메인 피자집에서 수제 맥주 파는 곳이 흔치 않은데,네이버후드는 수제 맥주를 판매하고 있어 넘 좋더라고요 !​맛있는 피자와 맥주의 조합 넘 좋습니다 !​  ​방문할 당시 오늘의 맥주는 4.7%의 무심코 페일에일이었답니다.맥주를 주문하면 사장님께서 바로 따라 주십니다.​위에 잔이 엄청 많은거 보이시죠 ?맥주마다 다른 잔으로 따라 주시더라고요 !​  NFC를 사용하여 주문할 수 있더라고요 !휴대폰을 잠금 해제하고 해당 위치에 올려 놓으면 메뉴판이 뜬 답니다.​휴대폰 뒷면 카메라 옆 부분에 NFC 인식칩이 있으니 위 쪽으로 올리면 바로 떠요 !혹시 인식이 안된다면 설정 > 연결 > NFC 및 비접촉 결제를 허용하면 됩니다.​  먼저 나온뭔헨라거(7.5)2잔 !네이버후드는 수제맥주집 답게 맥주 종류가 엄청 많아서 어떤 맥주를 마실까 고민했답니다.​  맥주를 마시고 있다보면 갓 구운 피자가 나옵니다.비주얼이 대박이죠 ?!​저희는고기러버스, 더치 피자 반반(26.0)으로 주문했어요 !한 판에 다양한 종류의 피자를 먹을 수 있으니 항상 반반 피자를 시키게 되는 것 같아요 ㅎㅎ피자도 종류가 많아 고민되었는데, 리뷰를 열심히 찾아보고 먹어보고 싶은 2종류로 결정했어요.​사이즈는 L 사이즈입니다.2명이 먹기 괜찮았는데, 여자 2분이서 방문하시면 기본 사이즈 하셔도 충분할 것 같아요.​  한 눈에 봐도 토핑이 듬뿍 들어있고, 윤기가 흘러 먹기 전부터 비주얼을 보고 너무 기대가 되었답니다.​특히 치즈가 아낌없이 들어있었어요.잘라서 먹다보면 치즈가 정말 뭉텅이로 있었어요 !!​ 접기/펴기네이버후드 | 신촌 고소한 치즈가 가득 들어간 피자와 수제 맥주를 맛볼  (1) 치즈가 끝까지 늘어나는거 보이시나요 !!​  먼저 고기러버스 피자 !베이컨, 페퍼로니, 소고기 등 다양한 고기류 토핑이 올라가 고기러버스 피자인가봐요.​맛은 콤비네이션 피자에 소고기 토핑이 올라간 맛 !근데 치즈양이 엄청 많아 고소함이 극대화 된답니다.​ 접기/펴기네이버후드 | 신촌 고소한 치즈가 가득 들어간 피자와 수제 맥주를 맛볼  (2) 처음에는 잘라 먹다가 나중에는 손으로 먹었어요 ! ㅋㅋ사장님께서 물티슈도 챙겨주시고 내부에 화장실도 있으니 참고하세요 !​  치즈와 토핑이 엄청 들어있는거 보이시죠 ?!​그리고 피자 도우가 정말 맛있었어요.끝부분은 바삭하고 안은 쫄깃해서 바게트 먹는 느낌이 들더라고요 !원래 피자 끝 부분은 항상 안먹고 버렸는데,네이버 후드의 피자 도우 끝은 맛있는 빵을 먹는 것 같아 끝까지 다 먹었답니다 ~!!​  그 다음은 더치 피자 !더치 피자는 감자와 토마토 소스 베이스의 피자 입니다.모짜렐라 바질 피자와 함께 고민했는데, 더치 피자로 선택하길 잘한것 같아요 !​  더치 피자에도 역시 치즈가 가득하더라고요 !​네이버후드의 더치 피자는 웨지감자 스타일이 아니라 직접 썬 감자의 느낌이었습니다.​토마토도 일반 피자와 같이 밑에 깔려진게 아니라 피자 위에 올려져 있고,인위적인 맛이 아닌 토마토 퓨레의 느낌이라 더 맛있었어요 !​토마토 소스 + 베이컨 + 감자 + 치즈 가득의 조합이라 맛없을 수 없는 조합 !​방문하신다면 더치 피자 맛보시는거 추천 드려요.  비오는 날 오랜만에 신촌에 방문하여 네이버 후드에서 피자와 수제 맥주를 먹었는데 너무 맛있더라고요 !피자 말고 다른 사이드 메뉴도 있어서 단체 모임에 방문하기도 좋을 것 같아요.​피자 토핑을 아낌없이 올려주시고 도우까지 맛있는 곳이에요 !​피자와 수제 맥주 조합이 생각 날 때 또 다시 방문하고 싶은 곳입니다.​감사합니다 :)​  ​","#신촌맛집, #신촌맥주, #신촌수제맥주, #신촌피자, #피자맛집, #수제맥주, #신촌피자포장, #신촌회식, #신촌회식장소",6,https://blog.naver.com/moong_0516/223510654958,,X
